A1: Owner | B1: Fantasy Team Name | C1: Total Points | D1: A Benson | E1: P Carter | F1: A Hopkins | G1: K Mendelson | H1: R Thompson | I1: M Cox | J1: S Thompson | K1: A Baldwin (Jnr) | L1: D Andrews | M1: J Colbrook | N1: M Bould | O1: K Gallagher | P1: A Baldwin (Sr) | Q1: D Rouse | R1: I Edwards | S1: J Press | T1: M Carter | U1: P Baldwin | V1: J Dey | W1: R Dickens | X1: M Trimmings | Y1: M Rouse | Z1: D Braithwaite | AA1: S Owens
A2: M Trimmings | B2: Bottom Bandits | C2: =SUM(D2:AA2) -> 16.5 | G2: 3.0 | H2: 1.0 | J2: 2.5 | O2: 2.0 | X2: 4.0 | AA2: 4.0
A3: M Carter | B3: Old Sluts | C3: =SUM(D3:AA3) -> 14.5 | E3: 2.5 | H3: 1.0 | I3: 1.5 | J3: 2.5 | T3: 3.0 | X3: 4.0
A4: R Dickens | B4: Dicko's Duffing Dozers | C4: =SUM(D4:AA4) -> 14.5 | G4: 3.0 | H4: 1.0 | J4: 2.5 | S4: 4.0 | T4: 3.0 | W4: 1.0
A5: J Dey | B5: The average weight of the European team at Melbage 19 was 19st 19lbs 19oz | C5: =SUM(D5:AA5) -> 13.5 | E5: 2.5 | G5: 3.0 | H5: 1.0 | Q5: 1.5 | S5: 4.0 | V5: 1.5
A6: A Baldwin (Jnr) | B6: Pure Fantasy | C6: =SUM(D6:AA6) -> 13.5 | G6: 3.0 | H6: 1.0 | I6: 1.5 | J6: 2.5 | S6: 4.0 | V6: 1.5
A7: P Baldwin | B7: TMMBWN | C7: =SUM(D7:AA7) -> 12.5 | G7: 3.0 | H7: 1.0 | J7: 2.5 | O7: 2.0 | T7: 3.0 | U7: 1.0
A8: D Braithwaite | B8: Watnobingo | C8: =SUM(D8:AA8) -> 12.0 | H8: 1.0 | I8: 1.5 | S8: 4.0 | T8: 3.0 | V8: 1.5 | Z8: 1.0
A9: P Carter | B9: It's In The Genes | C9: =SUM(D9:AA9) -> 11.5 | E9: 2.5 | H9: 1.0 | J9: 2.5 | K9: 1.5 | T9: 3.0 | U9: 1.0
A10: S Owens | B10: The Good, The Bad and The Ugly | C10: =SUM(D10:AA10) -> 11.5 | I10: 1.5 | J10: 2.5 | P10: 1.0 | Q10: 1.5 | Z10: 1.0 | AA10: 4.0
A11: J Press | B11: Buttons Big Bashers | C11: =SUM(D11:AA11) -> 11.5 | H11: 1.0 | I11: 1.5 | J11: 2.5 | S11: 4.0 | V11: 1.5 | Z11: 1.0
A12: S Thompson | B12: No DA so he'll score not shout 4 | C12: =SUM(D12:AA12) -> 11.5 | H12: 1.0 | J12: 2.5 | Q12: 1.5 | V12: 1.5 | W12: 1.0 | AA12: 4.0
A13: K Mendelson | B13: Mendy's Beach Babes | C13: =SUM(D13:AA13) -> 11.0 | E13: 2.5 | G13: 3.0 | H13: 1.0 | M13: 1.5 | O13: 2.0 | Z13: 1.0
A14: D Andrews | B14: Flying High | C14: =SUM(D14:AA14) -> 11.0 | F14: 0.0 | G14: 3.0 | H14: 1.0 | L14: 0.0 | S14: 4.0 | T14: 3.0
A15: K Gallagher | B15: Bubbs Tubbs | C15: =SUM(D15:AA15) -> 11.0 | H15: 1.0 | I15: 1.5 | O15: 2.0 | S15: 4.0 | V15: 1.5 | Z15: 1.0
A16: D Bingham | B16: Romans | C16: =SUM(D16:AA16) -> 10.5 | H16: 1.0 | J16: 2.5 | L16: 0.0 | O16: 2.0 | S16: 4.0 | Z16: 1.0
A17: A Hopkins | B17: Baggashite Boys | C17: =SUM(D17:AA17) -> 10.5 | H17: 1.0 | J17: 2.5 | Q17: 1.5 | T17: 3.0 | V17: 1.5 | Z17: 1.0
A18: M Cox | B18: The Diabetic Six | C18: =SUM(D18:AA18) -> 10.5 | E18: 2.5 | G18: 3.0 | H18: 1.0 | I18: 1.5 | J18: 2.5 | L18: 0.0
A19: I Edwards | B19: Tiger's Bimbo | C19: =SUM(D19:AA19) -> 10.5 | G19: 3.0 | H19: 1.0 | I19: 1.5 | J19: 2.5 | U19: 1.0 | V19: 1.5
A20: D Rouse | B20: The Manky Murkins | C20: =SUM(D20:AA20) -> 10.5 | I20: 1.5 | Q20: 1.5 | S20: 4.0 | V20: 1.5 | W20: 1.0 | Z20: 1.0
A21: M Bould | B21: The BackSwingers | C21: =SUM(D21:AA21) -> 9.5 | H21: 1.0 | I21: 1.5 | J21: 2.5 | N21: 2.5 | W21: 1.0 | Z21: 1.0
A22: J Colbrook | B22: Jeffer's All Stars | C22: =SUM(D22:AA22) -> 9.0 | H22: 1.0 | I22: 1.5 | L22: 0.0 | M22: 1.5 | U22: 1.0 | AA22: 4.0
A23: R Thompson | B23: The Chief Wiggums | C23: =SUM(D23:AA23) -> 7.5 | F23: 0.0 | H23: 1.0 | L23: 0.0 | S23: 4.0 | V23: 1.5 | Z23: 1.0
A24: A Baldwin (Snr) | B24: Turncoat's Natural Hazards | C24: =SUM(D24:AA24) -> 7.0 | F24: 0.0 | I24: 1.5 | K24: 1.5 | O24: 2.0 | P24: 1.0 | W24: 1.0
A25: M Rouse | B25: R. Swipes | C25: =SUM(D25:AA25) -> 6.5 | H25: 1.0 | L25: 0.0 | O25: 2.0 | Q25: 1.5 | W25: 1.0 | Y25: 1.0